{
  "schemaVersion": "2.0.0",
  "checkpoint": "SETUP-00-CP-0008",
  "generatedAt": "2026-09-20T22:04:29Z",
  "matrix": "REQUIREMENTS-MATRIX.json",
  "auditor": "Delivery Completeness Validator, emulated in the implementing session",
  "scopeFingerprint": "1503fa5ee1257db2b1c73482313d0e76ffd168d703b25879db21c22ed73b99f6",
  "totalRequirements": 131,
  "expectedRequirements": 131,
  "expectedSetSource": "derived by policies.expected_requirement_refs from the canonical Gate specification, the lesson preflight and the open independent audit findings and attacks",
  "mandatoryRequirements": 130,
  "complete": 131,
  "partial": 0,
  "missing": 0,
  "notApplicable": 0,
  "inProgress": 0,
  "notStarted": 0,
  "coveragePercent": 100.0,
  "evidenceCoveragePercent": 100.0,
  "result": "PASS",
  "findings": []
}
